{
  "$schema": "https://json-schema.org/draft/2020-12/schema",
  "$id": "https://vibe-machine.github.io/ontology-gist/manifests/package-manifest.schema.json",
  "title": "Ontology Package Manifest",
  "type": "object",
  "required": [
    "manifestVersion",
    "package",
    "upstream",
    "generator",
    "artifacts"
  ],
  "properties": {
    "manifestVersion": {
      "type": "string"
    },
    "package": {
      "type": "object",
      "required": [
        "name",
        "version"
      ],
      "properties": {
        "name": {
          "type": "string"
        },
        "version": {
          "type": "string"
        }
      },
      "additionalProperties": false
    },
    "upstream": {
      "type": "object",
      "required": [
        "repoUrl",
        "tag",
        "commit",
        "sourceArtifacts"
      ],
      "properties": {
        "repoUrl": {
          "type": "string"
        },
        "tag": {
          "type": "string"
        },
        "commit": {
          "type": "string"
        },
        "sourceArtifacts": {
          "type": "array",
          "items": {
            "type": "object",
            "required": [
              "path",
              "sha256"
            ],
            "properties": {
              "path": {
                "type": "string"
              },
              "sha256": {
                "type": "string"
              }
            },
            "additionalProperties": false
          }
        }
      },
      "additionalProperties": false
    },
    "generator": {
      "type": "object",
      "required": [
        "name",
        "version",
        "generatedAt"
      ],
      "properties": {
        "name": {
          "type": "string"
        },
        "version": {
          "type": "string"
        },
        "generatedAt": {
          "type": "string"
        }
      },
      "additionalProperties": false
    },
    "artifacts": {
      "type": "array",
      "items": {
        "type": "object",
        "required": [
          "kind",
          "path",
          "sha256"
        ],
        "properties": {
          "kind": {
            "type": "string"
          },
          "path": {
            "type": "string"
          },
          "sha256": {
            "type": "string"
          }
        },
        "additionalProperties": false
      }
    }
  },
  "additionalProperties": false
}
