{
  "manifestVersion": "1.0.0",
  "package": {
    "name": "trace-to-knowledge",
    "version": "1.0.1"
  },
  "upstream": {
    "repoUrl": "https://github.com/vibe-machine/ontology-trace-to-knowledge",
    "tag": "v1.0.1",
    "commit": "069ec423819b81ffdbc05bf050e8e57661fbe154",
    "sourceArtifacts": [
      {
        "path": "package.json",
        "sha256": "eacf59caa2a9f2b504590c64f90c850ffc88110575ce54da0e4bdef5ea9693ab"
      },
      {
        "path": "schema/traceToKnowledge.tql",
        "sha256": "3a264aa23dde48c839ca758a587b2047a951e153491cf08a0de081e16f1b796a"
      },
      {
        "path": "docs/translation/schema-docs.json",
        "sha256": "856bea90f656db7cbe6c6481e1ea38d134bb96618500c451e4be86a8e6f3e6e2"
      },
      {
        "path": "tools/package_contract/refresh_package_contract.mjs",
        "sha256": "2ecf880a21e89e19cd9d11b08edd14f57a33055a65a0b39de798b2501c6e7230"
      }
    ]
  },
  "generator": {
    "name": "trace-to-knowledge-package-refresh",
    "version": "0.1.0",
    "generatedAt": "2026-03-08T15:44:22.330Z"
  },
  "artifacts": [
    {
      "kind": "documentation",
      "path": "data/trace-to-knowledge-schema-docs.tql",
      "sha256": "0892b1d03a769cbcda476e610b9f655c36995999413b07a119fee06e38152c89"
    },
    {
      "kind": "manifest-schema",
      "path": "manifests/package-manifest.schema.json",
      "sha256": "07599fe20623f3304bec0987320050f12efc1faf04fad7c12176ffe88e0b6a48"
    },
    {
      "kind": "provenance-seeds",
      "path": "data/trace-to-knowledge-provenance.tql",
      "sha256": "02a2d746001d8d2679a01f8dd352b3a21971eb2a06c90cec4a9a4e1db3381e6b"
    }
  ]
}
