{
  "manifestVersion": "1.0.0",
  "package": {
    "name": "trace-to-knowledge",
    "version": "2.0.0"
  },
  "upstream": {
    "repoUrl": "https://github.com/vibe-machine/ontology-trace-to-knowledge",
    "tag": "v2.0.0",
    "commit": "78278e66f2c9db585824ae0b1f389dd42e67ab1b",
    "sourceArtifacts": [
      {
        "path": "package.json",
        "sha256": "e2e0a8aad24357113b2df7f5d0bc36fba8f24b31d003705eaef58d893b170d93"
      },
      {
        "path": "schema/traceToKnowledge.tql",
        "sha256": "3a264aa23dde48c839ca758a587b2047a951e153491cf08a0de081e16f1b796a"
      },
      {
        "path": "docs/translation/schema-docs.json",
        "sha256": "856bea90f656db7cbe6c6481e1ea38d134bb96618500c451e4be86a8e6f3e6e2"
      },
      {
        "path": "tools/package_contract/refresh_package_contract.mjs",
        "sha256": "553afd263adb340ae18fb5e1568410ac2a00506c003ccaf099bd78f2aa888edc"
      }
    ]
  },
  "generator": {
    "name": "trace-to-knowledge-package-refresh",
    "version": "0.1.0",
    "generatedAt": "2026-03-28T14:03:46.832Z"
  },
  "artifacts": [
    {
      "kind": "documentation",
      "path": "data/trace-to-knowledge-schema-docs.tql",
      "sha256": "4d2c1a430ace2b468b45e2c12130111f47c28a47b87261290be8777383987376"
    },
    {
      "kind": "manifest-schema",
      "path": "manifests/package-manifest.schema.json",
      "sha256": "07599fe20623f3304bec0987320050f12efc1faf04fad7c12176ffe88e0b6a48"
    },
    {
      "kind": "provenance-seeds",
      "path": "data/trace-to-knowledge-provenance.tql",
      "sha256": "f16e4760e0c4d0636a862d1a1151d4e07af83ca8cdb3387565cafb5670ca85eb"
    }
  ]
}
