{
  "manifestVersion": "1.0.0",
  "package": {
    "name": "trace-to-knowledge",
    "version": "1.0.5"
  },
  "upstream": {
    "repoUrl": "https://github.com/vibe-machine/ontology-trace-to-knowledge",
    "tag": "v1.0.5",
    "commit": "3092bc6034bb1fb62469b8fa7d395307dc9626e8",
    "sourceArtifacts": [
      {
        "path": "package.json",
        "sha256": "1f906727e5d2649210016cdfa8dde4fd27e8f4f7cc15bec1ec084d96127bc018"
      },
      {
        "path": "schema/traceToKnowledge.tql",
        "sha256": "3a264aa23dde48c839ca758a587b2047a951e153491cf08a0de081e16f1b796a"
      },
      {
        "path": "docs/translation/schema-docs.json",
        "sha256": "856bea90f656db7cbe6c6481e1ea38d134bb96618500c451e4be86a8e6f3e6e2"
      },
      {
        "path": "tools/package_contract/refresh_package_contract.mjs",
        "sha256": "a2b508f9e1c69946045b1542320c465496776b354990feb10979296d9632a438"
      }
    ]
  },
  "generator": {
    "name": "trace-to-knowledge-package-refresh",
    "version": "0.1.0",
    "generatedAt": "2026-03-11T02:26:23.188Z"
  },
  "artifacts": [
    {
      "kind": "documentation",
      "path": "data/trace-to-knowledge-schema-docs.tql",
      "sha256": "5e0eb63ee0aa7c311d7ffd3ce63167eca38996a1da5f742313c2a5eaf582f37f"
    },
    {
      "kind": "manifest-schema",
      "path": "manifests/package-manifest.schema.json",
      "sha256": "07599fe20623f3304bec0987320050f12efc1faf04fad7c12176ffe88e0b6a48"
    },
    {
      "kind": "provenance-seeds",
      "path": "data/trace-to-knowledge-provenance.tql",
      "sha256": "485986b1fc2d6005cd06452a112592619fe78ee52d7fed74612a3f8142214c18"
    }
  ]
}
