{
  "manifestVersion": "1.0.0",
  "package": {
    "name": "trace-to-knowledge",
    "version": "2.0.3"
  },
  "upstream": {
    "repoUrl": "https://github.com/vibe-machine/ontology-trace-to-knowledge",
    "tag": "v2.0.3",
    "commit": "c6062950d669204892550ab44ec5da749c291853",
    "sourceArtifacts": [
      {
        "path": "package.json",
        "sha256": "c3c7f9f09f82536ebac6ac66e7f76f5a58c4649caab173fbe303af6f3874f57b"
      },
      {
        "path": "schema/traceToKnowledge.tql",
        "sha256": "3a264aa23dde48c839ca758a587b2047a951e153491cf08a0de081e16f1b796a"
      },
      {
        "path": "docs/translation/schema-docs.json",
        "sha256": "856bea90f656db7cbe6c6481e1ea38d134bb96618500c451e4be86a8e6f3e6e2"
      },
      {
        "path": "tools/package_contract/refresh_package_contract.mjs",
        "sha256": "553afd263adb340ae18fb5e1568410ac2a00506c003ccaf099bd78f2aa888edc"
      }
    ]
  },
  "generator": {
    "name": "trace-to-knowledge-package-refresh",
    "version": "0.1.0",
    "generatedAt": "2026-04-10T14:57:10.337Z"
  },
  "artifacts": [
    {
      "kind": "documentation",
      "path": "data/trace-to-knowledge-schema-docs.tql",
      "sha256": "8d0b7f5a9adb1fd64e03f2ae16516e298c9240b89ddb124b0594f207ca123afc"
    },
    {
      "kind": "manifest-schema",
      "path": "manifests/package-manifest.schema.json",
      "sha256": "07599fe20623f3304bec0987320050f12efc1faf04fad7c12176ffe88e0b6a48"
    },
    {
      "kind": "provenance-seeds",
      "path": "data/trace-to-knowledge-provenance.tql",
      "sha256": "a4d4cd6e7a4a01906e6c2c6415f22a4a7ccfdc48dfa501019e93f2a29adb63cc"
    },
    {
      "kind": "migration",
      "path": "migrations/v2.0.2-to-v2.0.3.tql",
      "sha256": "987f764c6bc301060a4adf2a088a6def39713dfd227f9aa33e1fb781d829f48c"
    }
  ]
}
